{
  "version": "0.1",
  "variant": "4T",
  "score": 56,
  "available_moves": 0,
  "terminal": true,
  "bbox": [
    -4,
    -2,
    10,
    10
  ],
  "description": "4T · 56 moves · Demaine et al. (2006)",
  "author": "Demaine, Demaine, Langerman & Langerman",
  "source": "http://www.morpionsolitaire.com/Grid4T56Demaine.gif",
  "transcribed_by": "morpion-solitaire.io",
  "moves": [
    {
      "x": 2,
      "y": -1,
      "dir": "V",
      "pos": 0
    },
    {
      "x": 1,
      "y": -2,
      "dir": "DN",
      "pos": 0
    },
    {
      "x": 4,
      "y": -1,
      "dir": "DP",
      "pos": 3
    },
    {
      "x": 4,
      "y": -2,
      "dir": "V",
      "pos": 0
    },
    {
      "x": 5,
      "y": 0,
      "dir": "H",
      "pos": 3
    },
    {
      "x": 0,
      "y": 1,
      "dir": "V",
      "pos": 0
    },
    {
      "x": 4,
      "y": 3,
      "dir": "V",
      "pos": 2
    },
    {
      "x": 7,
      "y": 4,
      "dir": "DN",
      "pos": 3
    },
    {
      "x": -1,
      "y": 2,
      "dir": "DN",
      "pos": 0
    },
    {
      "x": -2,
      "y": 2,
      "dir": "H",
      "pos": 0
    },
    {
      "x": 3,
      "y": 2,
      "dir": "H",
      "pos": 2
    },
    {
      "x": 6,
      "y": -1,
      "dir": "DP",
      "pos": 3
    },
    {
      "x": 1,
      "y": 0,
      "dir": "DN",
      "pos": 0
    },
    {
      "x": 3,
      "y": -2,
      "dir": "DP",
      "pos": 3
    },
    {
      "x": 2,
      "y": -2,
      "dir": "H",
      "pos": 1
    },
    {
      "x": 6,
      "y": 1,
      "dir": "DN",
      "pos": 3
    },
    {
      "x": 6,
      "y": 0,
      "dir": "V",
      "pos": 1
    },
    {
      "x": 7,
      "y": 0,
      "dir": "DP",
      "pos": 3
    },
    {
      "x": 8,
      "y": 0,
      "dir": "H",
      "pos": 3
    },
    {
      "x": 2,
      "y": 3,
      "dir": "V",
      "pos": 1
    },
    {
      "x": -1,
      "y": 0,
      "dir": "DN",
      "pos": 0
    },
    {
      "x": 0,
      "y": 0,
      "dir": "H",
      "pos": 1
    },
    {
      "x": 0,
      "y": 5,
      "dir": "DP",
      "pos": 0
    },
    {
      "x": 7,
      "y": 2,
      "dir": "H",
      "pos": 3
    },
    {
      "x": 8,
      "y": 1,
      "dir": "DP",
      "pos": 3
    },
    {
      "x": 9,
      "y": 2,
      "dir": "DN",
      "pos": 3
    },
    {
      "x": 6,
      "y": 5,
      "dir": "V",
      "pos": 3
    },
    {
      "x": 8,
      "y": 3,
      "dir": "DP",
      "pos": 2
    },
    {
      "x": 9,
      "y": 4,
      "dir": "DN",
      "pos": 3
    },
    {
      "x": 7,
      "y": 6,
      "dir": "DN",
      "pos": 3
    },
    {
      "x": -1,
      "y": 4,
      "dir": "H",
      "pos": 0
    },
    {
      "x": -2,
      "y": 5,
      "dir": "DP",
      "pos": 0
    },
    {
      "x": 3,
      "y": 4,
      "dir": "H",
      "pos": 1
    },
    {
      "x": 5,
      "y": 6,
      "dir": "DN",
      "pos": 3
    },
    {
      "x": 1,
      "y": 6,
      "dir": "DP",
      "pos": 0
    },
    {
      "x": -2,
      "y": 3,
      "dir": "DN",
      "pos": 0
    },
    {
      "x": -3,
      "y": 4,
      "dir": "DP",
      "pos": 0
    },
    {
      "x": -2,
      "y": 4,
      "dir": "V",
      "pos": 2
    },
    {
      "x": -4,
      "y": 4,
      "dir": "H",
      "pos": 0
    },
    {
      "x": 4,
      "y": 7,
      "dir": "V",
      "pos": 3
    },
    {
      "x": 8,
      "y": 4,
      "dir": "H",
      "pos": 3
    },
    {
      "x": 8,
      "y": 2,
      "dir": "V",
      "pos": 2
    },
    {
      "x": 10,
      "y": 2,
      "dir": "H",
      "pos": 3
    },
    {
      "x": 2,
      "y": 7,
      "dir": "DP",
      "pos": 0
    },
    {
      "x": 2,
      "y": 8,
      "dir": "V",
      "pos": 3
    },
    {
      "x": 5,
      "y": 8,
      "dir": "DN",
      "pos": 3
    },
    {
      "x": 3,
      "y": 8,
      "dir": "DP",
      "pos": 0
    },
    {
      "x": 0,
      "y": 6,
      "dir": "H",
      "pos": 0
    },
    {
      "x": 0,
      "y": 7,
      "dir": "V",
      "pos": 3
    },
    {
      "x": -1,
      "y": 6,
      "dir": "DN",
      "pos": 2
    },
    {
      "x": 4,
      "y": 9,
      "dir": "DN",
      "pos": 3
    },
    {
      "x": 6,
      "y": 6,
      "dir": "H",
      "pos": 3
    },
    {
      "x": 6,
      "y": 7,
      "dir": "DP",
      "pos": 2
    },
    {
      "x": 6,
      "y": 8,
      "dir": "V",
      "pos": 3
    },
    {
      "x": 4,
      "y": 8,
      "dir": "H",
      "pos": 2
    },
    {
      "x": 4,
      "y": 10,
      "dir": "V",
      "pos": 3
    }
  ]
}
