{
  "version": "0.1",
  "variant": "5D",
  "score": 82,
  "available_moves": 0,
  "terminal": true,
  "bbox": [
    -2,
    -1,
    12,
    13
  ],
  "description": "5D record · 82 moves · Christopher D. Rosin",
  "author": "Christopher D. Rosin",
  "source": "http://morpionsolitaire.com/Grid5D82Rosin.txt",
  "transcribed_by": "morpion-solitaire.io",
  "moves": [
    {
      "x": 2,
      "y": 2,
      "dir": "DP",
      "pos": 2
    },
    {
      "x": 6,
      "y": 10,
      "dir": "V",
      "pos": 4
    },
    {
      "x": 4,
      "y": 6,
      "dir": "H",
      "pos": 4
    },
    {
      "x": 5,
      "y": 3,
      "dir": "H",
      "pos": 0
    },
    {
      "x": 2,
      "y": 0,
      "dir": "H",
      "pos": 0
    },
    {
      "x": 9,
      "y": 7,
      "dir": "V",
      "pos": 4
    },
    {
      "x": 0,
      "y": 2,
      "dir": "V",
      "pos": 0
    },
    {
      "x": 10,
      "y": 6,
      "dir": "H",
      "pos": 4
    },
    {
      "x": 7,
      "y": 9,
      "dir": "H",
      "pos": 4
    },
    {
      "x": 8,
      "y": 8,
      "dir": "DP",
      "pos": 2
    },
    {
      "x": 7,
      "y": 2,
      "dir": "DN",
      "pos": 2
    },
    {
      "x": 8,
      "y": 4,
      "dir": "DN",
      "pos": 2
    },
    {
      "x": 3,
      "y": 4,
      "dir": "V",
      "pos": 4
    },
    {
      "x": 4,
      "y": 3,
      "dir": "H",
      "pos": 4
    },
    {
      "x": 3,
      "y": 5,
      "dir": "V",
      "pos": 0
    },
    {
      "x": 2,
      "y": 4,
      "dir": "DN",
      "pos": 2
    },
    {
      "x": 4,
      "y": 4,
      "dir": "DP",
      "pos": 2
    },
    {
      "x": 1,
      "y": 4,
      "dir": "H",
      "pos": 1
    },
    {
      "x": 4,
      "y": 1,
      "dir": "DP",
      "pos": 4
    },
    {
      "x": 4,
      "y": 2,
      "dir": "V",
      "pos": 2
    },
    {
      "x": 5,
      "y": 2,
      "dir": "H",
      "pos": 2
    },
    {
      "x": 6,
      "y": 4,
      "dir": "DN",
      "pos": 4
    },
    {
      "x": 1,
      "y": 5,
      "dir": "DP",
      "pos": 1
    },
    {
      "x": 2,
      "y": 5,
      "dir": "DP",
      "pos": 1
    },
    {
      "x": 4,
      "y": 5,
      "dir": "H",
      "pos": 4
    },
    {
      "x": 2,
      "y": -1,
      "dir": "DN",
      "pos": 0
    },
    {
      "x": 5,
      "y": 5,
      "dir": "DP",
      "pos": 2
    },
    {
      "x": 2,
      "y": 1,
      "dir": "V",
      "pos": 2
    },
    {
      "x": 1,
      "y": 1,
      "dir": "DN",
      "pos": 0
    },
    {
      "x": 0,
      "y": 1,
      "dir": "H",
      "pos": 0
    },
    {
      "x": 1,
      "y": 2,
      "dir": "V",
      "pos": 1
    },
    {
      "x": -1,
      "y": 2,
      "dir": "DN",
      "pos": 0
    },
    {
      "x": -2,
      "y": 2,
      "dir": "H",
      "pos": 0
    },
    {
      "x": -1,
      "y": 3,
      "dir": "DN",
      "pos": 1
    },
    {
      "x": 3,
      "y": -1,
      "dir": "DP",
      "pos": 4
    },
    {
      "x": -1,
      "y": 0,
      "dir": "DN",
      "pos": 0
    },
    {
      "x": 6,
      "y": 5,
      "dir": "V",
      "pos": 4
    },
    {
      "x": 5,
      "y": 4,
      "dir": "DP",
      "pos": 2
    },
    {
      "x": 5,
      "y": 6,
      "dir": "V",
      "pos": 4
    },
    {
      "x": 7,
      "y": 4,
      "dir": "H",
      "pos": 2
    },
    {
      "x": 4,
      "y": 7,
      "dir": "DP",
      "pos": 0
    },
    {
      "x": 1,
      "y": 0,
      "dir": "DN",
      "pos": 0
    },
    {
      "x": -2,
      "y": 3,
      "dir": "DP",
      "pos": 0
    },
    {
      "x": -1,
      "y": 4,
      "dir": "DP",
      "pos": 0
    },
    {
      "x": 2,
      "y": 7,
      "dir": "DN",
      "pos": 4
    },
    {
      "x": -1,
      "y": 1,
      "dir": "V",
      "pos": 1
    },
    {
      "x": 2,
      "y": 8,
      "dir": "V",
      "pos": 4
    },
    {
      "x": 7,
      "y": 5,
      "dir": "V",
      "pos": 3
    },
    {
      "x": 5,
      "y": 7,
      "dir": "DP",
      "pos": 0
    },
    {
      "x": 1,
      "y": 7,
      "dir": "H",
      "pos": 0
    },
    {
      "x": 8,
      "y": 5,
      "dir": "H",
      "pos": 3
    },
    {
      "x": 5,
      "y": 8,
      "dir": "DP",
      "pos": 0
    },
    {
      "x": 4,
      "y": 8,
      "dir": "H",
      "pos": 2
    },
    {
      "x": 7,
      "y": 11,
      "dir": "DN",
      "pos": 4
    },
    {
      "x": 4,
      "y": 10,
      "dir": "V",
      "pos": 4
    },
    {
      "x": 5,
      "y": 11,
      "dir": "DN",
      "pos": 4
    },
    {
      "x": 5,
      "y": 10,
      "dir": "V",
      "pos": 3
    },
    {
      "x": 8,
      "y": 7,
      "dir": "V",
      "pos": 4
    },
    {
      "x": 7,
      "y": 8,
      "dir": "DP",
      "pos": 2
    },
    {
      "x": 8,
      "y": 9,
      "dir": "DN",
      "pos": 4
    },
    {
      "x": 7,
      "y": 7,
      "dir": "DP",
      "pos": 3
    },
    {
      "x": 7,
      "y": 10,
      "dir": "V",
      "pos": 3
    },
    {
      "x": 8,
      "y": 10,
      "dir": "H",
      "pos": 4
    },
    {
      "x": 9,
      "y": 11,
      "dir": "DN",
      "pos": 4
    },
    {
      "x": 10,
      "y": 7,
      "dir": "H",
      "pos": 4
    },
    {
      "x": 11,
      "y": 8,
      "dir": "DN",
      "pos": 4
    },
    {
      "x": 8,
      "y": 11,
      "dir": "DN",
      "pos": 4
    },
    {
      "x": 6,
      "y": 11,
      "dir": "H",
      "pos": 1
    },
    {
      "x": 8,
      "y": 12,
      "dir": "V",
      "pos": 4
    },
    {
      "x": 7,
      "y": 12,
      "dir": "DN",
      "pos": 4
    },
    {
      "x": 9,
      "y": 8,
      "dir": "DP",
      "pos": 3
    },
    {
      "x": 10,
      "y": 8,
      "dir": "H",
      "pos": 3
    },
    {
      "x": 10,
      "y": 9,
      "dir": "DN",
      "pos": 4
    },
    {
      "x": 10,
      "y": 10,
      "dir": "V",
      "pos": 4
    },
    {
      "x": 9,
      "y": 9,
      "dir": "DN",
      "pos": 3
    },
    {
      "x": 9,
      "y": 10,
      "dir": "DP",
      "pos": 2
    },
    {
      "x": 6,
      "y": 12,
      "dir": "DP",
      "pos": 0
    },
    {
      "x": 11,
      "y": 9,
      "dir": "DN",
      "pos": 4
    },
    {
      "x": 9,
      "y": 12,
      "dir": "V",
      "pos": 4
    },
    {
      "x": 5,
      "y": 12,
      "dir": "H",
      "pos": 0
    },
    {
      "x": 7,
      "y": 13,
      "dir": "DP",
      "pos": 0
    },
    {
      "x": 12,
      "y": 9,
      "dir": "H",
      "pos": 4
    }
  ]
}
