{
  "version": "0.1",
  "variant": "4D",
  "score": 35,
  "available_moves": 0,
  "terminal": true,
  "bbox": [
    -3,
    -2,
    9,
    8
  ],
  "description": "4D record · 35 moves · Hyyrö & Poranen (optimal, Quist 2008)",
  "author": "Heikki Hyyrö & Timo Poranen",
  "source": "http://www.morpionsolitaire.com/Grid4D35HyyroPoranen.gif",
  "transcribed_by": "morpion-solitaire.io",
  "moves": [
    {
      "x": 7,
      "y": 4,
      "dir": "DN",
      "pos": 3
    },
    {
      "x": 8,
      "y": 4,
      "dir": "H",
      "pos": 3
    },
    {
      "x": 2,
      "y": 7,
      "dir": "V",
      "pos": 3
    },
    {
      "x": 1,
      "y": 8,
      "dir": "DP",
      "pos": 0
    },
    {
      "x": 1,
      "y": 6,
      "dir": "H",
      "pos": 0
    },
    {
      "x": 4,
      "y": 3,
      "dir": "V",
      "pos": 0
    },
    {
      "x": 3,
      "y": 4,
      "dir": "H",
      "pos": 2
    },
    {
      "x": 0,
      "y": 7,
      "dir": "DP",
      "pos": 0
    },
    {
      "x": 6,
      "y": 1,
      "dir": "V",
      "pos": 0
    },
    {
      "x": 7,
      "y": 0,
      "dir": "DP",
      "pos": 3
    },
    {
      "x": 5,
      "y": 0,
      "dir": "H",
      "pos": 3
    },
    {
      "x": 0,
      "y": 5,
      "dir": "V",
      "pos": 3
    },
    {
      "x": 3,
      "y": 2,
      "dir": "H",
      "pos": 1
    },
    {
      "x": 6,
      "y": 5,
      "dir": "DN",
      "pos": 3
    },
    {
      "x": 6,
      "y": -1,
      "dir": "DP",
      "pos": 3
    },
    {
      "x": 2,
      "y": 3,
      "dir": "V",
      "pos": 3
    },
    {
      "x": -1,
      "y": 6,
      "dir": "DP",
      "pos": 0
    },
    {
      "x": 4,
      "y": -1,
      "dir": "V",
      "pos": 0
    },
    {
      "x": 7,
      "y": 2,
      "dir": "DN",
      "pos": 3
    },
    {
      "x": 8,
      "y": 1,
      "dir": "DP",
      "pos": 3
    },
    {
      "x": 9,
      "y": 2,
      "dir": "DN",
      "pos": 3
    },
    {
      "x": 8,
      "y": 2,
      "dir": "H",
      "pos": 2
    },
    {
      "x": 8,
      "y": 3,
      "dir": "V",
      "pos": 2
    },
    {
      "x": 5,
      "y": 6,
      "dir": "DP",
      "pos": 0
    },
    {
      "x": 6,
      "y": 7,
      "dir": "DN",
      "pos": 3
    },
    {
      "x": -1,
      "y": 4,
      "dir": "DN",
      "pos": 0
    },
    {
      "x": 5,
      "y": -2,
      "dir": "DP",
      "pos": 3
    },
    {
      "x": -2,
      "y": 5,
      "dir": "DP",
      "pos": 0
    },
    {
      "x": -3,
      "y": 4,
      "dir": "DN",
      "pos": 0
    },
    {
      "x": -2,
      "y": 4,
      "dir": "H",
      "pos": 1
    },
    {
      "x": -1,
      "y": 2,
      "dir": "DN",
      "pos": 0
    },
    {
      "x": -2,
      "y": 2,
      "dir": "H",
      "pos": 0
    },
    {
      "x": -2,
      "y": 3,
      "dir": "V",
      "pos": 1
    },
    {
      "x": 0,
      "y": 1,
      "dir": "DP",
      "pos": 3
    },
    {
      "x": -1,
      "y": 0,
      "dir": "DN",
      "pos": 0
    }
  ]
}
